{
  "schemaVersion": 1,
  "asOf": "2026-08-11",
  "status": "complete_current_evaluation_coverage_promotion_gated",
  "purpose": "Bind every registered company workflow to a separate evaluation suite, explicit case count and input boundary, current result, and fail-closed promotion record without treating local tests as independent production evidence.",
  "authority": {
    "workflowPromotionAuthorized": false,
    "autonomyIncreaseAuthorized": false,
    "schedulerActivationAuthorized": false,
    "credentialConnectionAuthorized": false,
    "permissionExpansionAuthorized": false,
    "baselineWriteAuthorized": false,
    "externalExecutionAuthorized": false,
    "spendAuthorized": false,
    "conversationIsAuthorization": false,
    "passingEvaluationIsAuthorization": false
  },
  "policy": {
    "separateEvaluatorScriptRequired": true,
    "everyRegisteredWorkflowMustBeCovered": true,
    "documentedCaseCountRequired": true,
    "inputBoundaryRequired": true,
    "networkUseMustBeExplicit": true,
    "productionCredentialsInEvaluationPermitted": false,
    "externalMutationInEvaluationPermitted": false,
    "selfPromotionPermitted": false,
    "minimumEligibleCyclesForPromotion": 4,
    "implementationChangeInvalidatesPriorResult": true,
    "policyModelToolDataPermissionChangeRequiresReevaluation": true,
    "localProcessCountsAsIndependentRuntime": false
  },
  "workflows": [
    { "workflowId": "A-001", "workflowVersion": 1, "implementationPath": "scripts/company/audit-public-footprint.cjs", "evaluatorPath": "scripts/company/test-public-footprint-audit.cjs", "evaluationMode": "offline_fixture_unit", "inputBoundary": "synthetic_http_responses_no_network", "documentedCaseCount": 6, "lastResult": "passed", "lastEvaluated": "2026-08-11", "separateEvaluatorScript": true, "networkAccessPermitted": false, "productionCredentialUsePermitted": false, "externalMutationPermitted": false, "eligibleCyclesCompleted": 0, "requiredEligibleCycles": 4, "promotionEligible": false, "externalExecutionEligible": false },
    { "workflowId": "A-002", "workflowVersion": 1, "implementationPath": "scripts/company/compile-weekly-review.cjs", "evaluatorPath": "scripts/company/test-weekly-review.cjs", "evaluationMode": "fixture_adversarial", "inputBoundary": "temporary_json_fixtures", "documentedCaseCount": 6, "lastResult": "passed", "lastEvaluated": "2026-08-11", "separateEvaluatorScript": true, "networkAccessPermitted": false, "productionCredentialUsePermitted": false, "externalMutationPermitted": false, "eligibleCyclesCompleted": 0, "requiredEligibleCycles": 4, "promotionEligible": false, "externalExecutionEligible": false },
    { "workflowId": "A-003", "workflowVersion": 1, "implementationPath": "scripts/company/validate-content-package.cjs", "evaluatorPath": "scripts/company/test-content-package.cjs", "evaluationMode": "fixture_adversarial", "inputBoundary": "temporary_json_fixtures", "documentedCaseCount": 7, "lastResult": "passed", "lastEvaluated": "2026-08-11", "separateEvaluatorScript": true, "networkAccessPermitted": false, "productionCredentialUsePermitted": false, "externalMutationPermitted": false, "eligibleCyclesCompleted": 0, "requiredEligibleCycles": 4, "promotionEligible": false, "externalExecutionEligible": false },
    { "workflowId": "A-004", "workflowVersion": 1, "implementationPath": "scripts/company/evaluate-support-triage.cjs", "evaluatorPath": "scripts/company/test-support-triage.cjs", "evaluationMode": "fixture_adversarial", "inputBoundary": "synthetic_sanitized_support_cases", "documentedCaseCount": 20, "lastResult": "passed", "lastEvaluated": "2026-08-11", "separateEvaluatorScript": true, "networkAccessPermitted": false, "productionCredentialUsePermitted": false, "externalMutationPermitted": false, "eligibleCyclesCompleted": 0, "requiredEligibleCycles": 4, "promotionEligible": false, "externalExecutionEligible": false },
    { "workflowId": "A-005", "workflowVersion": 1, "implementationPath": "scripts/company/synthesize-customer-evidence.cjs", "evaluatorPath": "scripts/company/test-customer-evidence-synthesis.cjs", "evaluationMode": "fixture_adversarial", "inputBoundary": "temporary_deidentified_json_fixtures", "documentedCaseCount": 5, "lastResult": "passed", "lastEvaluated": "2026-08-11", "separateEvaluatorScript": true, "networkAccessPermitted": false, "productionCredentialUsePermitted": false, "externalMutationPermitted": false, "eligibleCyclesCompleted": 0, "requiredEligibleCycles": 4, "promotionEligible": false, "externalExecutionEligible": false },
    { "workflowId": "A-006", "workflowVersion": 1, "implementationPath": "scripts/company/validate-measurement-contract.cjs", "evaluatorPath": "scripts/company/test-measurement-contract.cjs", "evaluationMode": "fixture_adversarial", "inputBoundary": "temporary_json_fixtures", "documentedCaseCount": 4, "lastResult": "passed", "lastEvaluated": "2026-08-11", "separateEvaluatorScript": true, "networkAccessPermitted": false, "productionCredentialUsePermitted": false, "externalMutationPermitted": false, "eligibleCyclesCompleted": 0, "requiredEligibleCycles": 4, "promotionEligible": false, "externalExecutionEligible": false },
    { "workflowId": "A-007", "workflowVersion": 1, "implementationPath": "scripts/company/validate-commercial-pipeline.cjs", "evaluatorPath": "scripts/company/test-commercial-pipeline.cjs", "evaluationMode": "fixture_adversarial", "inputBoundary": "temporary_public_source_json_fixtures", "documentedCaseCount": 5, "lastResult": "passed", "lastEvaluated": "2026-08-11", "separateEvaluatorScript": true, "networkAccessPermitted": false, "productionCredentialUsePermitted": false, "externalMutationPermitted": false, "eligibleCyclesCompleted": 0, "requiredEligibleCycles": 4, "promotionEligible": false, "externalExecutionEligible": false },
    { "workflowId": "A-008", "workflowVersion": 1, "implementationPath": "scripts/company/validate-channel-registry.cjs", "evaluatorPath": "scripts/company/test-channel-registry.cjs", "evaluationMode": "fixture_adversarial", "inputBoundary": "temporary_json_fixtures", "documentedCaseCount": 5, "lastResult": "passed", "lastEvaluated": "2026-08-11", "separateEvaluatorScript": true, "networkAccessPermitted": false, "productionCredentialUsePermitted": false, "externalMutationPermitted": false, "eligibleCyclesCompleted": 0, "requiredEligibleCycles": 4, "promotionEligible": false, "externalExecutionEligible": false },
    { "workflowId": "A-009", "workflowVersion": 1, "implementationPath": "scripts/company/validate-operations-registers.cjs", "evaluatorPath": "scripts/company/test-operations-registers.cjs", "evaluationMode": "fixture_adversarial", "inputBoundary": "temporary_vendor_and_risk_json_fixtures", "documentedCaseCount": 5, "lastResult": "passed", "lastEvaluated": "2026-08-11", "separateEvaluatorScript": true, "networkAccessPermitted": false, "productionCredentialUsePermitted": false, "externalMutationPermitted": false, "eligibleCyclesCompleted": 0, "requiredEligibleCycles": 4, "promotionEligible": false, "externalExecutionEligible": false },
    { "workflowId": "A-010", "workflowVersion": 1, "implementationPath": "scripts/company/audit-provider-policy-drift.cjs", "evaluatorPath": "scripts/company/test-provider-policy-drift.cjs", "evaluationMode": "isolated_repository_fixture", "inputBoundary": "temporary_synthetic_repository_no_secrets", "documentedCaseCount": 4, "lastResult": "passed", "lastEvaluated": "2026-08-11", "separateEvaluatorScript": true, "networkAccessPermitted": false, "productionCredentialUsePermitted": false, "externalMutationPermitted": false, "eligibleCyclesCompleted": 0, "requiredEligibleCycles": 4, "promotionEligible": false, "externalExecutionEligible": false },
    { "workflowId": "A-011", "workflowVersion": 1, "implementationPath": "scripts/company/validate-approval-envelope.cjs", "evaluatorPath": "scripts/company/test-approval-envelope.cjs", "evaluationMode": "fixture_adversarial", "inputBoundary": "temporary_json_fixtures", "documentedCaseCount": 4, "lastResult": "passed", "lastEvaluated": "2026-08-11", "separateEvaluatorScript": true, "networkAccessPermitted": false, "productionCredentialUsePermitted": false, "externalMutationPermitted": false, "eligibleCyclesCompleted": 0, "requiredEligibleCycles": 4, "promotionEligible": false, "externalExecutionEligible": false },
    { "workflowId": "A-012", "workflowVersion": 1, "implementationPath": "scripts/company/run-company-control-plane.cjs", "evaluatorPath": "scripts/company/test-company-control-plane.cjs", "evaluationMode": "system_integration", "inputBoundary": "current_control_plane_offline_verify", "documentedCaseCount": 1, "lastResult": "passed", "lastEvaluated": "2026-08-11", "separateEvaluatorScript": true, "networkAccessPermitted": false, "productionCredentialUsePermitted": false, "externalMutationPermitted": false, "eligibleCyclesCompleted": 0, "requiredEligibleCycles": 4, "promotionEligible": false, "externalExecutionEligible": false },
    { "workflowId": "A-013", "workflowVersion": 1, "implementationPath": "scripts/company/validate-editorial-queue.cjs", "evaluatorPath": "scripts/company/test-editorial-queue.cjs", "evaluationMode": "fixture_adversarial", "inputBoundary": "temporary_json_fixtures", "documentedCaseCount": 4, "lastResult": "passed", "lastEvaluated": "2026-08-11", "separateEvaluatorScript": true, "networkAccessPermitted": false, "productionCredentialUsePermitted": false, "externalMutationPermitted": false, "eligibleCyclesCompleted": 0, "requiredEligibleCycles": 4, "promotionEligible": false, "externalExecutionEligible": false },